{"schemaVersion":1,"variantId":"variant-kimetsu-zenitsu-yi-ming-jing-ren","idiomId":"idiom-yi-ming-jing-ren","collaboration":{"ipName":"鬼滅之刃","characterName":"我妻善逸","characterTitle":"鬼殺隊劍士"},"characterCore":"平時膽怯缺乏自信，真正危急時卻能爆發驚人的專注與實力","primaryMove":{"displayName":"雷之呼吸・壹之型 霹靂一閃","sourceStatus":"NeedsReview"},"subtitleOverride":"怯聲未止，雷鳴已至。","maximOverride":["怯聲藏雷威","一鳴震長空","拔刀如電掣","瞬閃斷群邪"],"visualDirection":"畫面先保持短暫寂靜，下一瞬金色雷線橫貫全場，人物以超高速拔刀從敵陣中心穿出。","rarity":"UR","contentStatus":"NeedsReview","publicationStatus":"not-approved-for-publication","licenseEvidenceId":null,"reviewHistory":[{"reviewedAt":"2026-08-08T23:10:00+08:00","reviewer":"ChatGPT","status":"NeedsReview","notes":"角色性格、成語配對、招式譯名與卡面演出均待 IP 授權及人工總校；不得分配正式 UR 卡號。"}]}
