{"schemaVersion":1,"variantId":"variant-kimetsu-obanai-shi-zhi-bu-yu","idiomId":"idiom-shi-zhi-bu-yu","collaboration":{"ipName":"鬼滅之刃","characterName":"伊黑小芭內","characterTitle":"蛇柱"},"characterCore":"對規範與信念極度嚴格，認定的人與道路便始終不改","primaryMove":{"displayName":"蛇之呼吸・伍之型 蜿蜿長蛇","sourceStatus":"NeedsReview"},"subtitleOverride":"蛇行無聲，此志不渝。","maximOverride":["一志守終生","蛇刃行無聲","嚴心護正道","至死情不渝"],"visualDirection":"蛇形刀光沿難以預測的曲線穿過敵陣，人物保持低調克制，斬擊最終回到守護目標之前。","rarity":"UR","contentStatus":"NeedsReview","publicationStatus":"not-approved-for-publication","licenseEvidenceId":null,"reviewHistory":[{"reviewedAt":"2026-08-08T23:10:00+08:00","reviewer":"ChatGPT","status":"NeedsReview","notes":"角色性格、成語配對、招式譯名與卡面演出均待 IP 授權及人工總校；不得分配正式 UR 卡號。"}]}
