{"schemaVersion":1,"variantId":"variant-kimetsu-gyomei-bei-tian-min-ren","idiomId":"idiom-bei-tian-min-ren","collaboration":{"ipName":"鬼滅之刃","characterName":"悲鳴嶼行冥","characterTitle":"岩柱"},"characterCore":"慈悲厚重，能感受眾生苦難，並以最堅強的意志承擔守護責任","primaryMove":{"displayName":"岩之呼吸・壹之型 蛇紋岩・雙極","sourceStatus":"NeedsReview"},"subtitleOverride":"慈悲如山，威猛如雷。","maximOverride":["悲願護蒼生","巨岩鎮邪祟","慈心含大勇","鐵志撼乾坤"],"visualDirection":"流星錘與巨斧從兩側夾擊敵人，鎖鏈形成山岳般的封鎖線，人物如巨岩屹立，淚光與威勢並存。","rarity":"UR","contentStatus":"NeedsReview","publicationStatus":"not-approved-for-publication","licenseEvidenceId":null,"reviewHistory":[{"reviewedAt":"2026-08-08T23:10:00+08:00","reviewer":"ChatGPT","status":"NeedsReview","notes":"角色性格、成語配對、招式譯名與卡面演出均待 IP 授權及人工總校；不得分配正式 UR 卡號。"}]}
