{"schemaVersion":1,"variantId":"variant-kimetsu-muichiro-xin-ru-zhi-shui","idiomId":"idiom-xin-ru-zhi-shui","collaboration":{"ipName":"鬼滅之刃","characterName":"時透無一郎","characterTitle":"霞柱"},"characterCore":"冷靜純粹、情緒不外露，專注時思緒澄澈且判斷極快","primaryMove":{"displayName":"霞之呼吸・漆之型 朧","sourceStatus":"NeedsReview"},"subtitleOverride":"霞掩其身，心澄如水。","maximOverride":["心靜如秋水","霞散見真心","天才藏鋒芒","一刃斷迷霧"],"visualDirection":"身影在多層霞霧中忽遠忽近，敵人視線被錯位殘像擾亂，最後一刀由靜止畫面中無聲出現。","rarity":"UR","contentStatus":"NeedsReview","publicationStatus":"not-approved-for-publication","licenseEvidenceId":null,"reviewHistory":[{"reviewedAt":"2026-08-08T23:10:00+08:00","reviewer":"ChatGPT","status":"NeedsReview","notes":"角色性格、成語配對、招式譯名與卡面演出均待 IP 授權及人工總校；不得分配正式 UR 卡號。"}]}
