{"schemaVersion":1,"variantId":"variant-kimetsu-inosuke-yong-wang-zhi-qian","idiomId":"idiom-yong-wang-zhi-qian","collaboration":{"ipName":"鬼滅之刃","characterName":"嘴平伊之助","characterTitle":"鬼殺隊劍士"},"characterCore":"率真好勝、無懼強敵，遇到阻礙便以本能與行動正面突破","primaryMove":{"displayName":"獸之呼吸・雙刀猛進演出","sourceStatus":"NeedsReview"},"subtitleOverride":"野性無畏，雙刃開路。","maximOverride":["野性裂重山","雙刃破強敵","勇往無回顧","赤誠護夥伴"],"visualDirection":"雙刀交錯向前撕裂風壓與岩壁，低角度鏡頭強化野性、速度與毫不退縮的衝擊感。","rarity":"UR","contentStatus":"NeedsReview","publicationStatus":"not-approved-for-publication","licenseEvidenceId":null,"reviewHistory":[{"reviewedAt":"2026-08-08T23:10:00+08:00","reviewer":"ChatGPT","status":"NeedsReview","notes":"角色性格、成語配對、招式譯名與卡面演出均待 IP 授權及人工總校；不得分配正式 UR 卡號。"}]}
