{"schemaVersion":1,"variantId":"variant-kimetsu-mitsuri-zhi-qing-zhi-xing","idiomId":"idiom-zhi-qing-zhi-xing","collaboration":{"ipName":"鬼滅之刃","characterName":"甘露寺蜜璃","characterTitle":"戀柱"},"characterCore":"情感真摯熱烈，坦率表達喜愛，也以愛與善意化為力量","primaryMove":{"displayName":"戀之呼吸・陸之型 貓足戀風","sourceStatus":"NeedsReview"},"subtitleOverride":"真情無偽，愛化神力。","maximOverride":["赤心映春花","至情生大勇","柔刃護所愛","無懼守眾人"],"visualDirection":"柔韌刀刃在空中畫出心形與花瓣般的高速曲線，輕盈步伐中爆發巨大力量，守護者位於她身後。","rarity":"UR","contentStatus":"NeedsReview","publicationStatus":"not-approved-for-publication","licenseEvidenceId":null,"reviewHistory":[{"reviewedAt":"2026-08-08T23:10:00+08:00","reviewer":"ChatGPT","status":"NeedsReview","notes":"角色性格、成語配對、招式譯名與卡面演出均待 IP 授權及人工總校；不得分配正式 UR 卡號。"}]}
