{"schemaVersion":1,"variantId":"variant-kimetsu-shinobu-mian-li-cang-zhen","idiomId":"idiom-mian-li-cang-zhen","collaboration":{"ipName":"鬼滅之刃","characterName":"胡蝶忍","characterTitle":"蟲柱"},"characterCore":"言笑柔和，內心堅毅敏銳，溫柔表象之下藏著鋒芒與決意","primaryMove":{"displayName":"蟲之呼吸・蝶之舞","sourceStatus":"NeedsReview"},"subtitleOverride":"笑意如蝶，鋒芒藏心。","maximOverride":["笑裡藏鋒芒","蝶影巡幽夜","柔羽掩寒針","毒刃斷邪念"],"visualDirection":"蝶群與柔光遮蔽突進軌跡，人物含笑持細刃直取要害，毒霧與寒芒形成柔與銳的反差。","rarity":"UR","contentStatus":"NeedsReview","publicationStatus":"not-approved-for-publication","licenseEvidenceId":null,"reviewHistory":[{"reviewedAt":"2026-08-08T23:10:00+08:00","reviewer":"ChatGPT","status":"NeedsReview","notes":"角色性格、成語配對、招式譯名與卡面演出均待 IP 授權及人工總校；不得分配正式 UR 卡號。"}]}
