{"schemaVersion":1,"variantId":"variant-kimetsu-tanjiro-bai-zhe-bu-nao","idiomId":"idiom-bai-zhe-bu-nao","collaboration":{"ipName":"鬼滅之刃","characterName":"竈門炭治郎","characterTitle":"鬼殺隊劍士"},"characterCore":"溫柔堅定，歷經苦難仍不放棄，也始終保有同理心","primaryMove":{"displayName":"火之神神樂・圓舞","sourceStatus":"NeedsReview"},"subtitleOverride":"仁心不滅，百折前行。","maximOverride":["仁心照長夜","百折志不移","火舞開生路","揮刃護眾生"],"visualDirection":"低姿起身後旋身斬出巨大火輪，火焰沿刀路向夜空展開，形成逆境中重新站起的構圖。","rarity":"UR","contentStatus":"NeedsReview","publicationStatus":"not-approved-for-publication","licenseEvidenceId":null,"reviewHistory":[{"reviewedAt":"2026-08-08T23:10:00+08:00","reviewer":"ChatGPT","status":"NeedsReview","notes":"角色性格、成語配對、招式譯名與卡面演出均待 IP 授權及人工總校；不得分配正式 UR 卡號。"}]}
