{"schemaVersion":1,"variantId":"variant-kimetsu-uzui-hao-qi-gan-yun","idiomId":"idiom-hao-qi-gan-yun","collaboration":{"ipName":"鬼滅之刃","characterName":"宇髄天元","characterTitle":"音柱"},"characterCore":"自信豪邁、重視華麗與氣勢，同時願為同伴承擔風險","primaryMove":{"displayName":"音之呼吸・伍之型 鳴弦奏奏","sourceStatus":"NeedsReview"},"subtitleOverride":"華麗如雷，豪氣凌雲。","maximOverride":["豪氣凌雲霄","雙刃奏雷音","華彩震全場","捨身護同伴"],"visualDirection":"雙刃高速旋舞引爆連續音爆，斬擊軌跡像樂譜包圍戰場，華麗火光中仍保留護住同伴的站位。","rarity":"UR","contentStatus":"NeedsReview","publicationStatus":"not-approved-for-publication","licenseEvidenceId":null,"reviewHistory":[{"reviewedAt":"2026-08-08T23:10:00+08:00","reviewer":"ChatGPT","status":"NeedsReview","notes":"角色性格、成語配對、招式譯名與卡面演出均待 IP 授權及人工總校；不得分配正式 UR 卡號。"}]}
