{"schemaVersion":1,"variantId":"variant-kimetsu-rengoku-guang-ming-lei-luo","idiomId":"idiom-guang-ming-lei-luo","collaboration":{"ipName":"鬼滅之刃","characterName":"煉獄杏壽郎","characterTitle":"炎柱"},"characterCore":"坦蕩正直、熱情真誠，始終忠於職責與信念","primaryMove":{"displayName":"炎之呼吸・奧義 玖之型 煉獄","sourceStatus":"NeedsReview"},"subtitleOverride":"炎心磊落，正道無回。","maximOverride":["烈焰照丹心","磊落行正道","縱死身不退","炎柱護黎明"],"visualDirection":"正面高速衝鋒，烈焰化作巨大火柱與旭日輪廓，人物位於畫面中軸，展現毫不閃避的堂正氣勢。","rarity":"UR","contentStatus":"NeedsReview","publicationStatus":"not-approved-for-publication","licenseEvidenceId":null,"reviewHistory":[{"reviewedAt":"2026-08-08T23:10:00+08:00","reviewer":"ChatGPT","status":"NeedsReview","notes":"角色性格、成語配對、招式譯名與卡面演出均待 IP 授權及人工總校；不得分配正式 UR 卡號。"}]}
