{"schemaVersion":1,"variantId":"variant-kimetsu-sanemi-ji-feng-jing-cao","idiomId":"idiom-ji-feng-jing-cao","collaboration":{"ipName":"鬼滅之刃","characterName":"不死川實彌","characterTitle":"風柱"},"characterCore":"性情暴烈卻極其堅韌，受盡傷痛仍以自己的方式守護至親","primaryMove":{"displayName":"風之呼吸・壹之型 塵旋風・削斬","sourceStatus":"NeedsReview"},"subtitleOverride":"風愈狂烈，志愈堅強。","maximOverride":["疾風知勁草","怒刃破陰霾","傷痕鑄鐵志","狂心護至親"],"visualDirection":"人物旋身掀起巨型風刃龍捲，傷痕與衣袍被狂風吹展，暴烈攻勢中心保留擋在親人之前的構圖。","rarity":"UR","contentStatus":"NeedsReview","publicationStatus":"not-approved-for-publication","licenseEvidenceId":null,"reviewHistory":[{"reviewedAt":"2026-08-08T23:10:00+08:00","reviewer":"ChatGPT","status":"NeedsReview","notes":"角色性格、成語配對、招式譯名與卡面演出均待 IP 授權及人工總校；不得分配正式 UR 卡號。"}]}
