{"schemaVersion":1,"variantId":"variant-kimetsu-giyu-wai-leng-nei-re","idiomId":"idiom-wai-leng-nei-re","collaboration":{"ipName":"鬼滅之刃","characterName":"富岡義勇","characterTitle":"水柱"},"characterCore":"外表寡言疏離，內心重情且願意默默承擔守護責任","primaryMove":{"displayName":"水之呼吸・拾壹之型 凪","sourceStatus":"NeedsReview"},"subtitleOverride":"水止無聲，丹心未冷。","maximOverride":["冷面藏丹心","靜水映孤月","臨危心不亂","一刃止狂瀾"],"visualDirection":"四周水勢與攻擊在人物身前瞬間歸於寂靜，孤月映在水面，冷靜姿態中帶出保護意味。","rarity":"UR","contentStatus":"NeedsReview","publicationStatus":"not-approved-for-publication","licenseEvidenceId":null,"reviewHistory":[{"reviewedAt":"2026-08-08T23:10:00+08:00","reviewer":"ChatGPT","status":"NeedsReview","notes":"角色性格、成語配對、招式譯名與卡面演出均待 IP 授權及人工總校；不得分配正式 UR 卡號。"}]}
