{"schemaVersion":1,"variantId":"variant-kimetsu-nezuko-she-ji-wei-ren","idiomId":"idiom-she-ji-wei-ren","collaboration":{"ipName":"鬼滅之刃","characterName":"竈門禰豆子","characterTitle":"主要角色"},"characterCore":"克制自身本能，屢次犧牲自己保護家人與無辜者","primaryMove":{"displayName":"血鬼術・爆血","sourceStatus":"NeedsReview"},"subtitleOverride":"血火燃身，只為護人。","maximOverride":["血火護至親","克己守人心","柔身擋危厄","一念破魔性"],"visualDirection":"以自身血焰包覆敵方攻擊，粉紅火光向外綻放，人物位於家人前方形成守護姿態。","rarity":"UR","contentStatus":"NeedsReview","publicationStatus":"not-approved-for-publication","licenseEvidenceId":null,"reviewHistory":[{"reviewedAt":"2026-08-08T23:10:00+08:00","reviewer":"ChatGPT","status":"NeedsReview","notes":"角色性格、成語配對、招式譯名與卡面演出均待 IP 授權及人工總校；不得分配正式 UR 卡號。"}]}
